{
  "contentRunId": "44444444-4444-4444-8444-444444444444",
  "versionSetHash": "aaaaaaaaaaaaaaaaaaaaaaaaaaaaaaaaaaaaaaaaaaaaaaaaaaaaaaaaaaaaaaaa",
  "gate": "pass_with_warnings",
  "scores": {
    "authenticity": 95,
    "sourceCoverage": 92,
    "structure": 88,
    "voiceAlignment": 91,
    "originality": 84,
    "formatFit": 90,
    "safety": 100,
    "artifactValidity": 96
  },
  "findings": [
    {
      "category": "personal_authenticity",
      "severity": "warning",
      "ruleId": "AUTH-CONFIRM-001",
      "message": "一处个人经历需要创作者确认公开边界。",
      "contentAssetVersionId": "77777777-7777-4777-8777-777777777777",
      "location": {
        "startOffset": 0,
        "endOffset": 17,
        "blockId": "opening"
      },
      "suggestedFix": "终审时确认该经历可公开，或改写为一般观察。",
      "relatedClaimIndexes": [
        0
      ]
    }
  ],
  "summary": "事实来源覆盖完整；批准前需要确认一处个人经历。"
}
